57633cd5,Deluxe cheezy mac,1480
7812a47,Onion mix for soups,5573
16f82957,Chicken a la king with noodles,2597
4cc3b99c,Pasta sides creamy pesto,5670
44cdf60b,Hearty vegetable ready to serve soup,8898
5cde6183,Chicken noodle,7937
c64a3fd2,Wisconsin cheddar mashed potatoes,4911
4bb66fdd,Original mashed potatoes,7746
76e5ba79,Jambalaya reduced sodium rice dinner mix,7295
da356672,Progresso Gluten Free Chicken & Rice Noodle Soup,3069
e8216586,Reduced Sodium Chicken Broth,2964
d343222d,Uncured pepperoni,2607
5b98ba44,Chicken oodle soup,5827
2ec9bd15,"Campbell,s soup steak & vegetable",3150
b5271575,Pepperoni pizza,7577
1a47362c,Sausage,4942
453c23d9,Knorr,9681
5bf1b71,Campbells sipping soup,753
e4edd2ae,Pepperoni pizza in a golden crust snack rollz,1581
4e2b342c,Bone broth beef,4302
f16e846a,Ravioli Végétariens,2060
ea5a8560,Organic hot & spicy lentils,1383
1a56a1bf,Tuna rolls,5241
1d7b01ae,Florida roll qbr,1108
e18a444,Spicy chipotle pulled chicken with sauce packets hot sandwich starters,6391
95cfe272,Pizza Melt - Pepperoni,9110
4eb69717,Stone Baked Pepperoni Pizza,9462
a40d3663,Mushroom asparagos flatbread pizza,9539
aab2f5d2,Tuna Salad,5195
9e160ac0,Cream of mushroom condensed soup,5116
91e58ec3,Supreme italian sausage,1088
750d24bf,CHEF BOYARDEE Mini Ravioli,5803
1b3e09e3,"Chick,n noodl, plant-based soup",737
a4981ab1,Long grain brown rice,2049
899111bd,Hickory smoked boneless pork chops,6317
bae389d5,"Campbell,s well yes soup chickpea and red pepper",4202
ba7197b6,Buffalo style chicken white chicken breast meat,7071
912f7285,An innovative blend of konjac flour & white rice,6321
d51a5290,Organic lentil vegetable soup,2456
979b5210,Original vegetable stock powder,9182
df3c896e,Greek creamy feta cheese spanakopita wrap,6672
41cabd38,Beef ravioli in pasta sauce,6035
4bb66fdd,Original mashed potatoes,7746
27cafacc,Organic vegetable broth,4361
6c8f02fa,3 meat sausage,1901
50acc43,"Campbell,s chunky soup vegetable",3787
a0bec1d1,Tuscan inspired chicken flatbread pizza,6459
624839e3,"Campbell,s condensed soup cream of chicken",671
da356672,Progresso Gluten Free Chicken & Rice Noodle Soup,3069
643fc67d,Penne pasta with extra virgin olive oil & sea salt,1519
55c6761,Cream of broccoli soup with cheese,2189
